{
  "$schema": "https://json-schema.org/draft/2020-12/schema",
  "$defs": {
    "Axes": {
      "description": "A reference marker: one arrow from the origin along each of +x, +y and\n+z.",
      "properties": {
        "shape": {
          "const": "axes",
          "default": "axes",
          "title": "Shape",
          "type": "string"
        },
        "length": {
          "exclusiveMinimum": 0,
          "title": "Length",
          "type": "number"
        }
      },
      "required": [
        "shape",
        "length"
      ],
      "title": "Axes",
      "type": "object"
    },
    "Box": {
      "description": "A rectangular box standing on its frame's origin: its base is centred\non the origin, and it rises along +z.",
      "properties": {
        "shape": {
          "const": "box",
          "default": "box",
          "title": "Shape",
          "type": "string"
        },
        "size_x": {
          "exclusiveMinimum": 0,
          "title": "Size X",
          "type": "number"
        },
        "size_y": {
          "exclusiveMinimum": 0,
          "title": "Size Y",
          "type": "number"
        },
        "size_z": {
          "exclusiveMinimum": 0,
          "title": "Size Z",
          "type": "number"
        }
      },
      "required": [
        "shape",
        "size_x",
        "size_y",
        "size_z"
      ],
      "title": "Box",
      "type": "object"
    },
    "Color": {
      "description": "An sRGB colour, each channel from 0 to 1.",
      "properties": {
        "r": {
          "maximum": 1.0,
          "minimum": 0.0,
          "title": "R",
          "type": "number"
        },
        "g": {
          "maximum": 1.0,
          "minimum": 0.0,
          "title": "G",
          "type": "number"
        },
        "b": {
          "maximum": 1.0,
          "minimum": 0.0,
          "title": "B",
          "type": "number"
        }
      },
      "required": [
        "r",
        "g",
        "b"
      ],
      "title": "Color",
      "type": "object"
    },
    "Cylinder": {
      "description": "An upright cylinder: its base is centred on its frame's origin and it\nrises along +z. A height of zero is allowed: a plant can be lowered by its\nwhole visible height.",
      "properties": {
        "shape": {
          "const": "cylinder",
          "default": "cylinder",
          "title": "Shape",
          "type": "string"
        },
        "radius": {
          "exclusiveMinimum": 0,
          "title": "Radius",
          "type": "number"
        },
        "height": {
          "minimum": 0,
          "title": "Height",
          "type": "number"
        }
      },
      "required": [
        "shape",
        "radius",
        "height"
      ],
      "title": "Cylinder",
      "type": "object"
    },
    "Ellipsoid": {
      "description": "An ellipsoid centred on its frame's origin, as long, wide and thick as\nits sizes along x, y and z, such as a leaflet lying in its frame's x-y\nplane.",
      "properties": {
        "shape": {
          "const": "ellipsoid",
          "default": "ellipsoid",
          "title": "Shape",
          "type": "string"
        },
        "size_x": {
          "exclusiveMinimum": 0,
          "title": "Size X",
          "type": "number"
        },
        "size_y": {
          "exclusiveMinimum": 0,
          "title": "Size Y",
          "type": "number"
        },
        "size_z": {
          "exclusiveMinimum": 0,
          "title": "Size Z",
          "type": "number"
        }
      },
      "required": [
        "shape",
        "size_x",
        "size_y",
        "size_z"
      ],
      "title": "Ellipsoid",
      "type": "object"
    },
    "Material": {
      "description": "What a fixture, or a part of the envelope, is made of.",
      "enum": [
        "steel",
        "aluminium",
        "plastic",
        "concrete",
        "substrate"
      ],
      "title": "Material",
      "type": "string"
    },
    "Plane": {
      "description": "A flat rectangle in its frame's x-y plane, centred on its origin,\nfacing +z.",
      "properties": {
        "shape": {
          "const": "plane",
          "default": "plane",
          "title": "Shape",
          "type": "string"
        },
        "size_x": {
          "exclusiveMinimum": 0,
          "title": "Size X",
          "type": "number"
        },
        "size_y": {
          "exclusiveMinimum": 0,
          "title": "Size Y",
          "type": "number"
        }
      },
      "required": [
        "shape",
        "size_x",
        "size_y"
      ],
      "title": "Plane",
      "type": "object"
    },
    "Point2": {
      "description": "A point in a shape's own x-y plane.",
      "properties": {
        "x": {
          "title": "X",
          "type": "number"
        },
        "y": {
          "title": "Y",
          "type": "number"
        }
      },
      "required": [
        "x",
        "y"
      ],
      "title": "Point2",
      "type": "object"
    },
    "Polygon": {
      "description": "A flat polygon in its frame's x-y plane, facing +z: its corners in\norder, counter-clockwise as seen from its front, such as a greenhouse's\ngable end.",
      "properties": {
        "shape": {
          "const": "polygon",
          "default": "polygon",
          "title": "Shape",
          "type": "string"
        },
        "points": {
          "items": {
            "$ref": "#/$defs/Point2"
          },
          "minItems": 3,
          "title": "Points",
          "type": "array"
        }
      },
      "required": [
        "shape",
        "points"
      ],
      "title": "Polygon",
      "type": "object"
    },
    "Quaternion": {
      "description": "A rotation as a unit quaternion; the default is no rotation.",
      "properties": {
        "w": {
          "default": 1.0,
          "title": "W",
          "type": "number"
        },
        "x": {
          "default": 0.0,
          "title": "X",
          "type": "number"
        },
        "y": {
          "default": 0.0,
          "title": "Y",
          "type": "number"
        },
        "z": {
          "default": 0.0,
          "title": "Z",
          "type": "number"
        }
      },
      "required": [
        "w",
        "x",
        "y",
        "z"
      ],
      "title": "Quaternion",
      "type": "object"
    },
    "SceneEntity": {
      "properties": {
        "entity_id": {
          "title": "Entity Id",
          "type": "string"
        },
        "kind": {
          "$ref": "#/$defs/SceneEntityKind"
        },
        "transform": {
          "$ref": "#/$defs/Transform"
        },
        "shape": {
          "$ref": "#/$defs/Shape"
        },
        "color": {
          "$ref": "#/$defs/Color"
        },
        "material": {
          "anyOf": [
            {
              "$ref": "#/$defs/Material"
            },
            {
              "type": "null"
            }
          ],
          "default": null
        },
        "label": {
          "anyOf": [
            {
              "type": "string"
            },
            {
              "type": "null"
            }
          ],
          "default": null,
          "title": "Label"
        },
        "properties": {
          "type": "object",
          "additionalProperties": {
            "anyOf": [
              {
                "type": "string"
              },
              {
                "type": "integer"
              },
              {
                "type": "number"
              },
              {
                "type": "boolean"
              }
            ]
          },
          "default": {},
          "title": "Properties"
        }
      },
      "required": [
        "entity_id",
        "kind",
        "transform",
        "shape",
        "color",
        "material",
        "label",
        "properties"
      ],
      "title": "SceneEntity",
      "type": "object"
    },
    "SceneEntityKind": {
      "enum": [
        "GROUND",
        "AXES",
        "GREENHOUSE_BOUNDS",
        "FLOOR",
        "WALL",
        "ROOF",
        "GUTTER",
        "FRAME",
        "VENT",
        "DOOR",
        "PLANTING_POSITION",
        "CROP_GUTTER",
        "BENCH",
        "SLAB",
        "WALKWAY",
        "SERVICE_ZONE",
        "KEEP_OUT",
        "RAIL",
        "PIPE",
        "WIRE",
        "OBSTACLE",
        "EQUIPMENT",
        "SENSOR",
        "CAMERA",
        "PLANT",
        "INTERNODE",
        "LEAF",
        "TRUSS",
        "FLOWER",
        "FRUIT"
      ],
      "title": "SceneEntityKind",
      "type": "string"
    },
    "Shape": {
      "oneOf": [
        {
          "$ref": "#/$defs/Plane"
        },
        {
          "$ref": "#/$defs/Cylinder"
        },
        {
          "$ref": "#/$defs/Box"
        },
        {
          "$ref": "#/$defs/Polygon"
        },
        {
          "$ref": "#/$defs/Sphere"
        },
        {
          "$ref": "#/$defs/Ellipsoid"
        },
        {
          "$ref": "#/$defs/Axes"
        }
      ]
    },
    "Sphere": {
      "description": "A sphere centred on its frame's origin, such as a flower bud or a\nfruit.",
      "properties": {
        "shape": {
          "const": "sphere",
          "default": "sphere",
          "title": "Shape",
          "type": "string"
        },
        "radius": {
          "exclusiveMinimum": 0,
          "title": "Radius",
          "type": "number"
        }
      },
      "required": [
        "shape",
        "radius"
      ],
      "title": "Sphere",
      "type": "object"
    },
    "Transform": {
      "description": "Places a shape's own frame in the world: rotate, then translate.",
      "properties": {
        "position": {
          "$ref": "#/$defs/Vector3"
        },
        "rotation": {
          "$ref": "#/$defs/Quaternion",
          "default": {
            "w": 1.0,
            "x": 0.0,
            "y": 0.0,
            "z": 0.0
          }
        }
      },
      "required": [
        "position",
        "rotation"
      ],
      "title": "Transform",
      "type": "object"
    },
    "Vector3": {
      "properties": {
        "x": {
          "title": "X",
          "type": "number"
        },
        "y": {
          "title": "Y",
          "type": "number"
        },
        "z": {
          "title": "Z",
          "type": "number"
        }
      },
      "required": [
        "x",
        "y",
        "z"
      ],
      "title": "Vector3",
      "type": "object"
    }
  },
  "description": "One greenhouse at one simulated day, as a viewer draws it. Positions\nand sizes are in metres, in right-handed world axes with z up.",
  "properties": {
    "schema_version": {
      "default": 16,
      "title": "Schema Version",
      "type": "integer"
    },
    "greenhouse_id": {
      "title": "Greenhouse Id",
      "type": "string"
    },
    "simulated_day": {
      "title": "Simulated Day",
      "type": "integer"
    },
    "entities": {
      "items": {
        "$ref": "#/$defs/SceneEntity"
      },
      "title": "Entities",
      "type": "array"
    }
  },
  "required": [
    "schema_version",
    "greenhouse_id",
    "simulated_day",
    "entities"
  ],
  "title": "SceneSnapshot",
  "type": "object"
}
